교과,학년군,성취기준코드,평가요소,상,중,하
과학,5-6학년군,[6과12-03],지구의 공전 이해하기,"지구의 공전을 이해하고, 천체 관측 프로그램을 활용하 여 계절에 따라 달라지는 별자리를 관찰한 뒤,","지구의 공전을 이해하고, 천체 관측 프로그램을 활용 하여 계절에 따라 달라지는 별자리의 변화를 설명할 수 있다.","천체 관측 프로그램을 활용하여 계절별 별자리를 관찰 하고, 계절에 따라 보이는 별자리가 달라짐을 이해할 수 있다."
국어,5-6학년군,[6국02-04],글쓴이의 관점에 대한 자신의 생각을 비교·대 조 해보기,"글쓴이의 관점을 자신의 생각과 비교·대조하여 설명하 고,","글쓴이의 관점을 자신의 생각과 비교하여 이해하고, 읽은 내용이 문제 해결에 어떻게 도움이 되는지 독서 토의에 참여할 수 있다.","글쓴이의 관점을 이해하고, 읽은 내용과 문제 상황을 연 결하여 문제 해결을 위한 의견을 제시할 수 있다."
국어,5-6학년군,[6국03-03],독서 과정 체험활동에 대한 감상하는 글쓰기,"독서 과정 체험활동에서 느낀 점을 바탕으로 감상하는 글 을 구체적으로 쓰고,","체험활동에서 느낀 점을 바탕으로 감상하는 글을 쓰고, 자신의 글과 친구의 글에 생각과 느낌이 적절히 표현했는 지 살펴볼 수 있다.","체험활동에서 느낀 점을 떠올려 문제 해결을 위한 제안을 써 보고,"
국어,5-6학년군,[6국02-01],이야기를 읽고 중심 사 건과 인물의 말과 행동 간추리기,"이야기를 읽고 중심 사건과 인물의 말과 행동을 핵심만 간추려 정리하며, 이를 바탕으로 이야기의 주제를 분명하 게 파악할 수 있다.","이야기의 중심 사건과 인물의 말과 행동을 간추려 정리하 고, 간추린 내용을 바탕으로 이야기의 주제를 찾아낼 수 있다.","이야기의 중심 사건과 인물의 말과 행동을 찾아 정리해 보고, 이를 바탕으로 이야기의 주제를 생각해 볼 수 있다."
국어,5-6학년군,[6국05-01],▪시나 이야기를 읽고 글 에 포함,"시나 이야기에 사용된 표현 방식과 그 의미를 스스로 추론 하고, 친구들과의 의견 나눔을 바탕으로 작가의 의도를 분명하게 파악할 수 있다.","시나 이야기 속 표현 방식의 의미를 생각해 보고, 친구들 과 의견을 나누며 작가의 의도를 이해할 수 있다.","시나 이야기에서 사용된 표현 방식을 찾아 의미를 생각해 보고, 친구들의 생각을 들으며 작가의 의도를 짐작해 볼 수 있다."
국어,5-6학년군,[6국01-04],▪면담의 목적과 절차를 이해하고 준비·진행·결 과 정리,"면담의 목적과 절차를 분명히 이해하여 질문과 매체를 적 절히 준비하고, 면담 상대를 배려하며 면담에 참여할 수 있다.","면담의 목적과 절차에 따라 질문과 매체를 준비하고, 상 대를 배려하는 태도로 면담에 참여할 수 있다.",안내에 따라 면담의 목적과 절차를 이해하고 질문과 매체 를 준비하여 면담에 참여할 수 있다.
국어,5-6학년군,[6국01-03],▪주제와 관련하여 다양 한 목적에 맞는 질문을 분명하게,"주제와 관련하여 다양한 목적에 맞는 질문을 분명하게 표 현하고,","주제에 맞는 질문을 분명하게 표현하며, 면담 과정을 성 찰하여 잘된 점과 보완할 점에 대해 친구들과 이야기 나눌 수 있다.","주제와 관련된 질문을 만들어 말해 보고, 안내에 따라 면 담 과정을 돌아보며 느낀 점에 대해 친구들과 소감을 나눌 수 있다."
국어,5-6학년군,[6국01-02],"주장하는 말을 듣고 주 장과 이유, 근거를 찾 기","주장하는 말을 들으며 주장을 정확히 파악하고 이유와 근 거를 찾아 정리하며, 제시된 이유와 근거가 주장이 타당 한지 논리적으로 설명할 수 있다.","주장하는 말을 듣고 주장과 이유, 근거를 찾아 정리하고, 제시된 이유와 근거의 타당성을 설명할 수 있다.","주장하는 말을 들으며 주장과 이유, 근거를 찾아 보고, 이 를 바탕으로 이유와 근거가 주장과 어울리는지 설명할 수 있다."
국어,5-6학년군,[6국02-03],"▪글과 자료를 보고 전달 하고자 하는 주장과 이 유,","다양한 자료를 보고 전달하고자 하는 주장과 이유, 근거 를 정확히 파악하고,","다양한 자료에 담긴 주장과 이유, 근거를 파악하고, 제시 된 주장과 이유의 타당성을 친구들과의 토론을 통해 설명 할 수 있다.","다양한 자료를 읽으며 주장과 이유, 근거를 찾아 정리하 고, 내용의 타당성과 표현의 적절성을 친구들과의 토론을 통해 파악할 수 있다."
국어,5-6학년군,[6국06-04],자신의 매체 이용 양상 을 돌아보고 성찰하기,"자신의 매체 이용 양상을 구체적으로 돌아보고,","자신의 매체 이용 양상을 돌아보고, 매체 이용의 장점이 나 개선점을 중심으로 자신의 매체 이용에 대해 성찰할 수 있다.","자신의 매체 이용 양상을 돌아보고, 자신의 매체 이용에 대해 느낀 점을 바탕으로 성찰할 수 있다."
국어,5-6학년군,[6국03-06],자신의 글을 독자와 공 유하려는 태도,매체 이용 양상 실태 보고서 쓰기 활동에 적극적으로 참여 하여 자신의 글을 독자와 공유하고 글을 나누는 과정에서 다른 사람의 생각을 존중하며,"매체 이용 양상 실태 보고서 쓰기 활동에 참여하여 자신의 글을 독자와 공유하고,","매체 이용 양상 실태 보고서 쓰기 활동에 참여하여 자신의 글을 독자와 공유하고, 자신의 생각이나 느낌을 표현하는 태도를 지닌다."
국어,5-6학년군,[6국04-03],고유어와 관용 표현의 쓰임과 가치를 이해하 기,"고유어와 관용 표현의 쓰임과 가치를 정확하게 이해하고, 다양한 상황에 어울리게 고유어와 관용 표현을 적절하게 활용하여 표현할 수 있다.","고유어와 관용 표현의 쓰임과 가치를 이해하고, 상황에 어울리게 고유어와 관용 표현을 활용하여 표현할 수 있다.","고유어와 관용 표현의 기본적인 뜻을 이해하고, 일부 상 황에서 고유어와 관용 표현을 사용하여 간단하게 표현할 수 있다."
국어,5-6학년군,[6국02-02],▪ 문맥을 고려하여 생략 된 내용이나 함,"글의 문맥을 종합적으로 고려하여 생략된 내용이나 함축 된 표현의 의미를 정확하게 추론하고, 그 근거를 분명하 게 설명할 수 있다.","글의 문맥을 고려하여 생략된 내용이나 함축된 표현의 의 미를 추론하고, 그 이유를 설명할 수 있다.",글의 문맥을 고려하여 생략된 내용이나 함축된 표현의 의 미를 추론할 수 있다.
국어,5-6학년군,[6국04-01],▪음성 언어와 문자 언어 의 특성을 바탕으로 매 체,"음성 언어와 문자 언어의 특성을 정확하게 이해하고, 다 양한 매체 자료의 표현 효과를 기준에 따라 판단하며,","음성 언어와 문자 언어의 특성을 이해하고, 매체 자료의 표현 효과를 판단하여 그 이유에 대한 의견을 나눌 수 있다.","음성 언어와 문자 언어의 일부 특성을 이해하고, 매체 자 료의 표현 효과를 간단하게 판단할 수 있다."
국어,5-6학년군,[6국03-04],▪독자와 매체를 고려하 여 기사문에 어울리는 내용,"독자와 매체의 특성을 충분히 고려하여 기사문과 같은 매 체에 적합한 글의 내용을 생성하고,","독자와 매체를 고려하여 기사문과 같은 매체 글의 내용을 생성하고, 알맞은 표현을 사용하여 글을 쓸 수 있다.","독자와 매체를 고려하여 기사문과 같은 매체 글의 내용을 생성하고, 기본적인 표현을 사용하여 글을 쓸 수 있다."
국어,5-6학년군,[6국05-05],▪자신의 경험을 시나 이 야기의 갈래 특성에 맞 게,"자신의 경험을 시나 이야기의 갈래 특성에 맞게 창의적으 로 표현하여, 작품의 의미와 느낌이 잘 드러나도록 나타 낼 수 있다.","자신의 경험을 문학 갈래의 특성을 살려, 시나 이야기로 알맞게 표현할 수 있다.",자신의 경험을 문학 갈래에 맞게 시나 이야기로 표현할 수 있다.
국어,5-6학년군,[6국03-06],이야기 바꾸어 쓰 기 활동에 적극적으 로 참여하는 태도,"이야기 바꾸어 쓰기 활동에 적극적으로 참여하며,","이야기 바꾸어 쓰기 활동에 참여하여, 자신의 글을 독자 와 공유하고 자신의 생각이나 느낌을 표현하는 태도를 지 닌다.","이야기 바꾸어 쓰기 활동에 참여하여, 자신의 글을 독자 와 공유하고 비교적 적절하게 자신의 생각이나 느낌을 표 현하는 태도를 지닌다."
사회,5-6학년군,[6사10-01],▪세계 여러 지역의 지 형 경관과 그에 따른 생활,"세계 여러 지역의 지형 경관의 특징을 분석하고, 세계 여 러 지역에서 나타나는 다양한 삶의 모습을 지형 경관과 관련지어 설명할 수 있다.","세계 여러 지역의 지형 경관을 조사하고, 다양한 삶의 모 습을 설명할 수 있다.","세계 여러 지역의 지형 경관의 특징을 제시하고, 다양한 삶의 모습을 제시할 수 있다."
사회,5-6학년군,[6사10-02],세계의 주요 기후의 특징을 비교하여 설명 하기,"세계의 다양한 기후의 특징을 비교하여 설명하고, 기후 환경과 인간생활 간의 관계를 관련지어 설명할 수 있다.","세계의 다양한 기후의 특징을 설명하고, 기후 환경과 인 간생활 간의 관계를 설명할 수 있다.","세계의 다양한 기후의 특징을 제시하고, 기후 환경과 인 간생활 간의 관계를 말할 수 있다."
사회,5-6학년군,[6사11-01],시장경제에서 가계와 기업의 역할을 설명하 기,"시장경제에서 가계와 기업의 역할을 비교하여 설명하고, 사례를 중심으로 근로자의 권리와 기업의 자유 및 책임을 분석할 수 있다.","시장경제에서 가계와 기업의 역할을 설명하고, 근로자의 권리와 기업의 자유 및 책임을 설명할 수 있다.","시장경제에서 가계와 기업의 역할을 찾고, 근로자의 권리 와 기업의 자유 및 책임을 제시할 수 있다."
사회,5-6학년군,[6사11-02],경제성장이 우리 생활 에 미치는 영향을 설 명하기,"경제성장이 우리 생활에 미치는 영향을 분석하고, 빠른 경제성장으로 발생한 문제의 해결 방안을 제안하고 그 이 유를 설명할 수 있다.","경제성장이 우리 생활에 미치는 영향을 설명하고, 빠른 경제성장으로 발생한 문제의 해결 방안을 제안할 수 있다.",경제성장이 우리 생활에 미치는 영향을 찾아 빠른 경제성 장으로 발생한 문제의 해결 방안을 제시할 수 있다.
사회,5-6학년군,[6사11-03],무역 사례를 분석하여 무역의 의미와 중요성 설명하기,"사례를 통해 무역의 의미와 중요성을 설명하고, 국가 간 무역이 발생하는 이유를 분석할 수 있다,","사례를 통해 무역의 의미와 중요성을 제시하고, 국가 간 무역이 발생하는 이유를 설명할 수 있다.","무역의 의미를 찾고, 국가 간 무역이 발생하는 이유를 말 할 수 있다."
사회,5-6학년군,[6사12-01],세계의 인구 분포 양 상을 비교하여 설명하 기,"세계 인구 분포 양상을 비교하여 설명하고, 여러 국가의 인구 자료를 근거로 국가별 인구 특징을 추론할 수 있다.","세계 인구 분포 양상을 설명하고, 여러 국가의 인구 특징 을 설명할 수 있다.","세계 인구 분포 모습을 제시하고, 여러 국가의 인구 특징 을 말할 수 있다."
사회,5-6학년군,[6사12-02],지구촌을 위협하는 문 제 설명하기,지구촌의 평화와 발전을 위협하는 문제를 분석하여 지속 가능한 미래를 위한 해결 방안을 제안하고 그 이유를 설명 할 수 있다.,"지구촌의 평화와 발전을 위협하는 문제를 설명하고, 지속 가능한 미래를 위한 해결 방안을 제안할 수 있다.","지구촌의 평화와 발전을 위협하는 문제를 제시하고, 지속 가능한 미래를 위한 해결 방안을 제시할 수 있다."
수학,5-6학년군,[6수01-11],"▪ ‘(자연수)÷(분 수)’,","‘(자연수)÷(분수)’, ‘(분수)÷(분수)’를 여러 가지 방법 으로 계산하고, 그 계산 원리를 설명할 수 있다.","‘(자연수)÷(분수)’, ‘(분수)÷(분수)’를 계산하고, 그 계 산 원리를 설명할 수 있다.","‘(자연수)÷(분수)’, ‘(분수)÷(분수)’를 계산할 수 있다."
수학,5-6학년군,[6수03-09],"▪쌓기나무로 만든 입체 도형을 보고,","쌓기나무로 만든 입체도형의 개수를 정확하게 구하고, 그 방법을 여러 가지 방법으로 설명할 수 있다.","쌓기나무로 만든 입체도형의 개수를 정확하게 구하고, 그 방법을 설명할 수 있다.",쌓기나무로 만든 간단한 입체도형의 개수를 정확하게 구 할 수 있다.
수학,5-6학년군,[6수03-10],"▪ 쌓기나무로 만든 입체도형의 위, 앞,","쌓기나무로 만든 입체도형의 위, 앞, 옆에서 본 모양을 표현하고, 이러한 표현을 보고 입체도형의 모양을 추론 하며,","쌓기나무로 만든 입체도형의 위, 앞, 옆에서 본 모양을 표현하고, 이러한 표현을 보고 입체도형의 모양을 추론 할 수 있다.","쌓기나무로 만든 간단한 입체도형의 위, 앞, 옆에서 본 모양을 표현하고, 이러한 표현을 보고 입체도형의 모양 을 추측할 수 있다."
수학,5-6학년군,[6수01-15],"▪‘(자연수)÷(소수)’,","‘(자연수)÷(소수)’, ‘(소수)÷(소수)’를 정확하게 계산하 고, 계산 원리를 논리적으로 설명할 수 있다.","‘(자연수)÷(소수)’, ‘(소수)÷(소수)’를 계산하고, 계산 원리를 설명할 수 있다.","간단한 ‘(자연수)÷(소수)’, ‘(소수)÷(소수)’를 계산할 수 있다."
수학,5-6학년군,[6수02-04],▪ 비례식의 성질을 활용하여 비례식 문 제 해결하기,"비례식 문제를 다양한 방법으로 해결하고, 그 방법을 설 명할 수 있다.","비례식 문제를 해결하고, 그 방법을 설명할 수 있다.",비례식 문제를 해결할 수 있다.
수학,5-6학년군,[6수02-05],▪ 실생활 속 비례 배분 문제 해결하기,"실생활 문제를 비례배분을 이용하여 정확하게 해결하고, 그 방법을 설명할 수 있다.",실생활 문제를 비례배분을 이용하여 해결할 수 있다.,"비례배분의 의미를 알고, 간단한 비례배분을 할 수 있다."
수학,5-6학년군,[6수03-15],"▪여러 가지 원 모양 물 체의 원주와 지름을 측정하고,","여러 가지 원 모양 물체의 원주와 지름을 측정하는 활동 을 통하여 원주율의 의미를 추론하여 설명하고,","여러 가지 원 모양 물체의 원주와 지름을 측정하는 활동 을 통하여 원주율의 의미를 설명하고, 원주율을 근삿값 으로 나타내어 사용할 수 있다.","주어진 원 모양 물체의 원주와 지름을 측정하는 활동을 통하여 원주율이 일정한 값임을 파악하고, 원주율의 근 삿값을 사용할 수 있다."
수학,5-6학년군,[6수03-16],▪ 원주와 원의 넓 이를 구하고 설명하기,"원주와 원의 넓이를 구하는 방법을 논리적으로 설명하 고, 원주와 원의 넓이를 정확하게 구할 수 있다.","원주와 원의 넓이를 구하는 방법을 설명하고, 원주와 원 의 넓이를 구할 수 있다.",원주와 원의 넓이를 구할 수 있다.
수학,5-6학년군,[6수03-07],"▪원기둥, 원뿔, 구의 구 성 요소, 성질 설명 하기","원기둥, 원뿔, 구에서 구성 요소를 찾고, 여러 가지 성질 을 설명할 수 있다.","원기둥, 원뿔, 구에서 구성 요소를 찾고, 성질을 설명할 수 있다.","원기둥, 원뿔, 구에서 구성 요소를 찾을 수 있다."
수학,5-6학년군,[6수03-08],▪원기둥 전개도 그리기,"원기둥의 전개도가 될 수 있는 것과 될 수 없는 것으로 구별하고, 원기둥의 전개도를 그려 그 방법을 설명할 수 있다.","원기둥의 전개도가 될 수 있는 것과 될 수 없는 것으로 구 별하고, 원기둥의 전개도를 그릴 수 있다.",원기둥의 전개도를 그릴 수 있다.
과학,5-6학년군,[6과13-01],"태양 고도, 그림자 길 이, 기온 측정하기","태양 고도 측정기를 만들어 하루 동안 태양 고도, 그림자 길이, 기온을 일정한 시간 간격으로 측정하여 그래프로 나타내고,","태양 고도 측정기로 하루 동안 태양 고도, 그림자 길이, 기온을 측정하여 그래프로 나타내고, 각 요소 간의 관계 를 찾을 수 있다.","하루 동안 태양 고도, 그림자 길이, 기온을 측정하고, 이 를 그래프로 그릴 수 있다."
과학,5-6학년군,[6과13-02],▪스마트 기기를 활용하 여 계절별 태양의 남 중 고도와,"계절에 따른 태양의 남중 고도와 낮의 길이를 조사하고,","월별 태양의 남중 고도와 낮의 길이를 조사하고, 계절에 따라 태양의 남중 고도에 따라 낮의 길이가 달라진다는 관계를 추론할 수 있다.","월별 태양의 남중 고도와 낮의 길이를 조사하고, 계절에 따라 낮의 길이가 달라진다는 것을 인식할 수 있다."
과학,5-6학년군,[6과13-03],지구의 공전과 자전축 기울기의 영향 이해 하기,지구의 공전 모형 실험을 통해 일정한 면적의 지표면이 받는 태양 에너지의 양을 근거로 계절의 변화가 생기는 이유를 설명할 수 있다.,지구의 공전 모형 실험을 통해 계절 변화의 원인을 지구 의 자전축이 기울어진 채 공전한다는 것으로 설명할 수 있다.,"지구의 자전축이 기울어진 채 공전할 때 나타나는 그림 자 길이와 태양의 남중 고도를 관찰하고, 계절의 변화가 생김을 인식할 수 있다."
과학,5-6학년군,[6과14-01],서로 다른 물질을 섞 기 전과 후의 변화 관 찰하기,서로 다른 물질을 섞기 전과 후의 성질을 비교하여 물질 의 성질이 달라지는 변화와 달라지지 않는 변화가 있음 을 비교하고 추론하여 설명할 수,서로 다른 물질을 섞은 후 나타나는 변화를 근거로 하여 물질의 성질이 달라졌음을 설명할 수 있다.,서로 다른 물질을 섞었을 때 물질의 성질이 달라질 수 있 음을 말할 수 있다.
과학,5-6학년군,[6과14-02],연소 시 나타나는 공 통 현상 관찰하기,"물질이 연소하는 여러 사례를 관찰하여 나타나는 현상을 기록하고,","물질이 연소하는 경우에 나타나는 현상을 관찰하여 기록 하고, 연소에 필요한 공통적인 조건을 찾아 설명할 수 있다.","물질이 탈 때 나타나는 공통적인 현상이 있음을 인식하 고, 필요한 조건을 일부 말할 수 있다."
과학,5-6학년군,[6과14-03],연소 전과 후의 물질 비교하기,연소 생성물을 확인하는 실험에서 연소 전과 후의 물질 을 비교해서 연소 과정에서 물질의 성질이 달라짐을 설 명할 수 있다.,연소 생성물을 확인하는 실험에서 연소 전과 후의 물질 을 비교할 수 있다.,연소 후 생성되는 물질이 있음을 말할 수 있다.
과학,5-6학년군,[6과14-04],연소 생성물로 인한 생태계 피해 사례 수 집하기,"연소 과정에서 생성된 물질로 인한 생태계의 피해 사례 를 수집하며,","연소 과정에서 생성되는 물질로 인한 생태계의 피해 사 례를 수집하고, 이를 연결하여 원인과 영향을 설명할 수 있다.",연소 생성물로 인한 생태계 피해 사례를 조사할 수 있다.
과학,5-6학년군,[6과15-01],▪전구에 불이 켜지는 전기 회로와 불이 켜 지지 않는,"다양한 회로 연결 방법을 비교하고 전구에 불이 켜지는 전기 회로의 전지, 전구,","전구에 불이 켜지는 전기 회로와 켜지지 않는 전기 회로 의 전지, 전구, 전선의 연결 특징을 비교하고,",전구에 불이 켜지는 전기 회로와 전구에 불이 켜지지 않 는 전기 회로를 비교하여 차이점을 찾을 수 있다.
과학,5-6학년군,[6과15-02],▪직렬 연결한 전지 수 가 다른 전기 회로의 특징,"전지 한 개와 두 개를 직렬연결한 전기 회로에서 나타나 는 차이점을 관찰하고, 친구들과 함",전지 한 개와 두 개를 직렬연결한 전기 회로에서 나타나 는 현상을 관찰하며 어떤 차이가 나타나는지 특징을 비 교하여 찾을 수 있다.,전지 한 개와 두 개를 직렬연결한 전기 회로에서 나타나 는 현상에 차이점이 있음을 말할 수 있다.
과학,5-6학년군,[6과15-03],전자석을 만들어 전자 석의 성질 탐색하기,"전자석을 만들어 전자석에 어떤 성질이 나타나는 실험하 고 영구자석의 성질과 비교하여 탐색한 결과를 정리할 수 있으며,","전자석을 만들어 전자석에 나타나는 성질을 탐색하고 이 해할 수 있으며, 전자석을 사용하는 사례를 조사하여 정 리할 수 있다.","전자석에 나타나는 성질을 실험을 통해 관찰하고, 전자 석이 이용되는 예를 조사할 수 있다."
과학,5-6학년군,[6과15-04],▪ 전기 사용 문제 상황을 근거로 안전 하고 효율적인,"전기 사용 문제 상황을 다양하게 제시하고,","전기 사용 문제 상황을 제시하고, 근거를 들어 안전하고 효율적인 해결 방안을 적절하게 제안하며 자신의 실천 의지를 서술할 수 있다.","전기 사용 문제 상황을 간단히 제시하고, 안전하거나 효 율적인 해결 방안을 제안하며 자신의 실천 의지를 짧게 서술할 수 있다."
과학,5-6학년군,[6과16-01],과학을 활용한 문제 해결 방안 토의하기,"미래 사회에 일어날 수 있는 다양한 문제를 조사하여 분 석하고, 문제를 해결하는 과학적인 방법을 제안하면서 토의를 할 수 있으며,","미래 사회에 일어날 수 있는 문제를 해결하기 위해 과학 이 기여할 수 있는 방법에 대해 토의할 수 있고,","미래 사회에 일어날 수 있는 문제를 해결하기 위한 의견 을 제시하며, 문제 해결을 위해 과학 기술이 필요함을 말 할 수 있다."
과학,5-6학년군,[6과16-02],다양한 직업과 과학 의 연관성 탐색하기,"다양한 직업군에서 과학이 활용되는 사례를 분석하고, 이를 바탕으로 자신의 희망 진로와 과학의 연관성을 구 체적인 근거를 들어 설명할 수 있다.","다양한 직업에 과학이 관련이 있음을 조사하고, 자신의 관심 분야나 희망 진로에서 과학이 쓰이는 경우가 있을 지 관련성을 설명할 수 있다.","여러 직업에 과학이 관련되어 있음을 알고, 자신의 진로 희망에 과학을 연결해서 말할 수 있다."
수학,3-4학년군,[4수01-03],▪덧셈과 뺄셈의 계산 원리를 적용하여 세 자리 수의,"받아올림이 있는 (세 자리 수)+(세 자리 수)와 받아내림이 있는 (세 자리 수)-(세 자리 수)를 계산하고, 그 계산 원리를 설명할 수 있다.",받아올림이 있는 (세 자리 수)+(세 자리 수)와 받아내림이 있는 (세 자리 수)-(세 자리 수)의 계산을 할 수 있다.,안내된 절차에 따라 받아올림이 있는 (세 자리 수)+(세 자리 수)와 받아내림이 있는 (세 자리 수)-(세 자리 수)의 간단한 계산을 할 수
수학,3-4학년군,[4수01-08],▪ 실생활 상황에서 덧셈과뺄셈의 어림을 활용하여 문제,"자연수의 덧셈, 뺄셈에서 계산 결과를 어림하며, 어림셈을 이용하여 계산 결과가 타당한지를 확인하고, 실생활 문제를 해결할 수 있다.","자연수의 덧셈, 뺄셈에서 계산 결과를 어림하며, 어림셈을 이용하여 계산 결과가 타당한지를 확인할 수 있다.","안내된 절차에 따라 자연수의 덧셈, 뺄셈의 계산 결과를 어림할 수 있다."
수학,3-4학년군,[4수03-01],"▪직선, 선분, 반직선의 예를 제시하고, 의미 설명하기","직선, 선분, 반직선의 예를 제시하고, 그 차이를 설명할 수 있다.","주어진 도형에서 직선, 선분, 반직선을 구별하고, 그 차이를 말할 수 있다.","주어진 도형에서 직선, 선분, 반직선을 구별할 수 있다."
수학,3-4학년군,[4수03-02],▪각과 직각의 의미와 특징을 알고 생활 속에서 직각과,"생활 주변 상황에서 다양한 각과 직각의 예를 찾아 그리고, 그 차이를 설명할 수 있다.",생활 주변 상황에서 다양한 각과 직각의 예를 찾아 그릴 수 있다.,주어진 도형에서 각과 직각을 구별할 수 있다.
