교과,학년군,성취기준코드,평가요소,상,중,하
수학,3-4학년군,[4수01-04],▪(세 자리 수)×(한 자리 수)와 (두 자리 수)×,"(세 자리 수)×(한 자리 수)와 (두 자리 수)×(두 자리 수)를 바르게 계산하고, 그 과정을 곱셈의 계산 원리 에 따라 설명할 수 있다.","(세 자리 수)×(한 자리 수)와 (두 자리 수)×(두 자리 수)를 바르게 계산하고, 과정 일부를 설명할 수 있다.",간단한 (세 자리 수)×(한 자리 수)와 (두 자리 수)× (두 자리 수)를 바르게 계산할 수 있다.
수학,3-4학년군,[4수01-08],▪곱하는 수가 한 자리 수 또는 두 자리 수인 곱셈,"곱하는 수가 한 자리 수 또는 두 자리 수인 곱셈을 여러 가지 상황에서 어림하고, 그 방법을 설명할 수 있다.","곱하는 수가 한 자리 수 또는 두 자리 수인 곱셈 결과를 어림하고, 그 방법을 설명할 수 있다.",곱하는 수가 한 자리 수 또는 두 자리 수인 곱셈 결과를 어림할 수 있다.
수학,3-4학년군,[4수01-05],▪나눗셈이 이루어지는 실생활 상황을 통하여 나누는 수가,"실생활 상황을 이용하여 나누는 수가 한 자리 수인 나눗셈 문제를 만들어 나눗셈식으로 나타내고, 그 의미를 논리적으로 설명할 수 있다.","실생활 상황을 이용하여 나누는 수가 한 자리 수인 나눗셈 문제를 만들어 나눗셈식으로 나타내고, 설명 할 수 있다.",실생활 상황을 이용하여 만든 문제를 나눗셈식으로 나타낼 수 있다.
수학,3-4학년군,[4수01-06],▪ 나누는 수가 한 자리 수인 나눗셈의 계산 원리를,"나누는 수가 한 자리 수인 나눗셈을 계산하여 몫과 나머지를 구하고, 몫과 나머지의 의미와 계산 원리를 설명할 수 있다.","나누는 수가 한 자리 수인 나눗셈을 계산하여 몫과 나머지를 구하고, 계산 원리를 설명할 수 있다.",나누는 수가 한 자리 수인 나눗셈을 계산하여 몫과 나머지를 구할 수 있다.
수학,3-4학년군,[4수01-08],▪실생활 속 다양한 나눗셈의 몫을 어림 하여 설명하기,"나눗셈의 몫을 여러 가지 상황에서 어림하고, 그 방법 을 설명할 수 있다.","나눗셈의 몫을 어림하고, 그 방법을 설명할 수 있다.",나눗셈의 몫을 어림할 수 있다.
수학,3-4학년군,[4수03-06],"▪원의 중심, 반지름, 지름을 알고, 성질 설명하기","다양한 원에서 원의 중심, 반지름, 지름을 모두 찾고, 여러 가지 원의 성질을 설명할 수 있다.","다양한 원에서 원의 중심, 반지름, 지름을 모두 찾고, 원의 성질을 설명할 수 있다.","주어진 원에서 원의 중심, 반지름, 지름을 모두 찾고, 원의 성질을 골라 말할 수 있다."
수학,3-4학년군,[4수03-07],▪컴퍼스를 이용하여 여러 가지 크기의 원을 그리고,"컴퍼스를 이용하여 조건에 맞는 다양한 크기의 원을 그리고, 그 방법을 원의 성질과 정확하게 연결하여 설명할 수 있다.","컴퍼스를 이용하여 다양한 크기의 원을 그리고, 그 방법을 설명할 수 있다.",컴퍼스를 이용하여 다양한 크기의 원을 그릴 수 있다.
수학,3-4학년군,[4수01-09],"▪전체에 대한 부분의 양,","전체에 대한 부분의 양을 분수로 나타내고, 전체에 대한 분수만큼은 얼마인지 구할 수 있으며, 그 의미를 설명할 수 있다.","전체에 대한 부분의 양을 분수로 나타내고, 전체에 대한 분수만큼은 얼마인지 구할 수 있다.",전체에 대한 부분의 양을 분수로 나타내거나 전체에 대한 분수만큼은 얼마인지 구할 수 있다.
수학,3-4학년군,[4수01-10],여러 가지 분수의 의미를 알고 구분하기,"진분수, 가분수, 대분수로 분류하고, 대분수를 가분수로, 가분수를 대분수로 나타내는 방법을 설명할 수 있다.","진분수, 가분수, 대분수로 분류하고, 대분수를 가분수로, 가분수를 대분수로 나타낼 수 있다.","진분수, 가분수, 대분수로 분류하고, 대분수를 가분수로 나타내거나 가분수를 대분수로 나타낼 수 있다."
수학,3-4학년군,[4수01-11],"▪분모가 같은 가분수,","분모가 같은 가분수, 대분수의 크기를 정확히 비교하고, 그 방법을 논리적으로 설명할 수 있다.","분모가 같은 가분수, 대분수의 크기를 비교하고, 그 방법을 설명할 수 있다.","분모가 같은 가분수, 대분수의 크기를 비교할 수 있다."
수학,3-4학년군,[4수03-17],▪들이의 표준 단위 1L와 1mL를 사용하여 측정하고,"들이를 비교하는 방법 탐색을 통하여 표준 단위의 필요성을 설명하고, 1L와 1mL를 이용하여 여러 가지 들이를 측정하고 어림할 수 있다.",1L와 1mL를 이용하여 여러 가지 들이를 측정하고 어림할 수 있다.,1L와 1mL를 이용하여 들이를 측정하고 어림할 수 있다.
수학,3-4학년군,[4수03-18],▪여러 가지 물건의 들 이를 ‘몇 L 몇 mL’와 ‘몇,"여러 가지 물건의 들이를 ‘몇 L 몇 mL’ 또는 ‘몇 mL’로 다양하게 표현하고, 그 까닭을 1L와 1mL의 관계를 바탕으로 설명할 수 있다.","여러 가지 물건의 들이를 ‘몇 L 몇 mL’ 또는 ‘몇 mL’로 표현하고, 그 까닭을 1L와 1mL의 관계를 바탕으로 설명할 수 있다.",주어진 들이를 ‘몇 L 몇 mL’ 또는 ‘몇 mL’로 다양하게 표현할 수 있다.
수학,3-4학년군,[4수03-19],▪ 실생활 문제 상황과 관련된 들이의 덧셈과 뺄셈 문제,"들이와 관련된 실생활 속 문제를 덧셈과 뺄셈으로 나타내어 정확하게 계산하고, 그 과정을 설명할 수 있다.",실생활 속 문제 상황을 들이의 덧셈과 뺄셈으로 나타내어 정확하게 계산할 수 있다.,들이의 덧셈과 뺄셈을 계산할 수 있다.
수학,3-4학년군,[4수03-20],▪무게의 표준 단위 1g과 1kg을 사용하여 측정 하고,"무게를 비교하는 방법 탐색을 통하여 표준 단위의 필요성을 설명하고, 1g과 1kg을 이용하여 여러 가지 무게를 측정하고 어림할 수 있다.",1g과 1kg을 이용하여 여러 가지 무게를 측정하고 어림할 수 있다.,1g과 1kg을 이용하여 들이를 측정하고 어림할 수 있다.
수학,3-4학년군,[4수03-21],▪여러 가지 물건의 무게를 ‘몇 kg 몇 g’과 ‘몇,"여러 가지 물건의 무게를 ‘몇 kg 몇 g’과 ‘몇 g’으로 다양하게 표현하고, 그 까닭을 1kg과 1g의 관계를 바탕으로 설명할 수 있다.","여러 가지 물건의 무게를 ‘몇 kg 몇 g’과 ‘몇 g’으로 표현하고, 그 까닭을 1kg과 1g의 관계를 바탕으로 설명할 수 있다.",주어진 무게를 ‘몇 kg 몇 g’과 ‘몇 g’으로 다양하게 표현 할 수 있다.
수학,3-4학년군,[4수03-22],"▪1t과 1kg의 관계를 이해하고,","실생활 속에서 1t을 활용하는 다양한 사례에서 ‘몇 t’을 ‘몇 kg’으로, ‘몇 kg’을 ‘몇 t’으로 표현하고,","실생활 속에서 1t을 활용하는 다양한 사례에서 ‘몇 t’을 ‘몇 kg’으로, ‘몇 kg’을 ‘몇 t’으로 표현할 수 있다.","주어진 무게를 ‘몇 t’을 ‘몇 kg’으로, ‘몇 kg’을 ‘몇 t’으로 표현할 수 있다."
수학,3-4학년군,[4수03-23],▪ 실생활 속 무게의 덧셈과 뺄셈 문제 해결 하기,"실생활 속 문제 상황을 무게의 덧셈과 뺄셈으로 나타 내어 정확하게 계산하고, 그 과정을 설명할 수 있다.",실생활 속 문제 상황을 무게의 덧셈과 뺄셈으로 나타 내어 정확하게 계산할 수 있다.,무게의 덧셈과 뺄셈을 계산할 수 있다.
수학,3-4학년군,[4수04-01],▪ 자료를 수집하여 그림그래프로 나타내고 해석하기,"실생활에서 여러 가지 자료를 수집, 분류, 정리하여 그림그래프로 나타내고 여러 가지 사실을 찾아 해석할 수 있다.","실생활에서 여러 가지 자료를 수집, 분류, 정리하여 그림그래프로 나타내고, 여러 가지 사실을 찾을 수 있다.","주어진 자료를 분류, 정리하여 그림그래프로 나타내고, 간단한 사실을 찾을 수 있다."
과학,3-4학년군,[4과05-01],물체와 물질의 의미 알기,"물체와 물질의 의미를 알고, 여러 가지 물질의 성질을 비교하여 설명할 수 있으며, 물질의 종류에 따라 물체를 분류할 수 있다.","물체와 물질의 의미를 알며,","물체와 물질의 의미를 알고, 여러 가지 물질의 성질을 간단히 비교할 수 있다."
과학,3-4학년군,[4과05-02],"▪물질의 세 가지 상태 (고체, 액체,","물질의 세 가지 상태인 고체, 액체, 기체가 가진 성질을 관찰하고, 물질의 세 가지 상태의 성질을 실험 결과를 토대로 비교하여 설명할 수 있다.","물질의 세 가지 상태인 고체, 액체, 기체가 가진 성질을 관찰하고, 물질의 세 가지 상태의 성질 일부를 설명 할 수 있다.","물질의 세 가지 상태인 고체, 액체, 기체를 관찰하고, 관찰한 사실을 말할 수 있다."
과학,3-4학년군,[4과05-03],물질의 성질을 이용 하여 생활용품 설계하기,"물체의 쓰임새에 적합한 성질을 가진 물질을 이용하여 생활용품을 설계하고, 물체의 쓰임새와 물질의 성질을 관련지어 설명할 수 있다.","물체의 쓰임새에 적합한 성질을 가진 물질을 선택하여 생활용품을 설계하고, 물체의 쓰임새를 설명할 수 있다.",물질의 성질을 간단히 고려하여 생활용품을 설계할 수 있다.
과학,3-4학년군,[4과06-01],지구가 대기로 둘러 싸여 있음을 이해하기,"지구가 대기로 둘러싸여 있음을 알고, 지구 표면을 구성하는 육지와 바다의 특징을 비교하여 정확히 비교할 수 있으며,","지구가 대기로 둘러싸여 있음을 알고, 지구 표면을 구성하는 육지와 바다의 면적과 특징을 비교하여 차이점을 일부 설명할 수 있다.","지구가 대기로 둘러싸여 있음을 알고, 지구 표면을 구성하는 육지와 바다의 면적을 비교할 수 있다."
과학,3-4학년군,[4과06-02],바닷물의 특징을 육지의 물과 비교하기,"육지의 물과 바닷물을 가열하여 남는 물질을 탐구하는 활동을 통해 바닷물의 특징을 육지의 물과 비교하고,","육지의 물과 바닷물을 가열하여 남는 물질을 비교하고, 바닷가에서 볼 수 있는 다양한 지형을 조사할 수 있다.",육지의 물과 바닷물을 가열하여 남는 물질을 관찰하여 차이점을 말할 수 있다.
과학,3-4학년군,[4과06-03],밀물과 썰물의 차이와 원리 설명하기,"밀물과 썰물의 차이를 명확하게 설명하고, 갯벌의 생태적･경제적･환경적 가치를 구체적인 사례를 들어 설명할 수 있으며,","밀물과 썰물의 차이를 설명하고, 갯벌의 생태적･ 경제적･환경적 가치를 설명할 수 있으며,","밀물과 썰물의 차이를 알고, 갯벌의 생태적･경제적･ 환경적 가치를 일부 설명할 수 있으며, 갯벌의 소중 함을 말할 수 있다."
과학,3-4학년군,[4과07-01],여러 가지 물체를 이용하여 소리내기,"여러 가지 물체를 이용해 소리를 내고, 그 현상을 관찰 함으로써 소리가 나는 물체는 떨림이 있다는 것을 설명 할 수 있으며,","여러 가지 물체를 이용하여 소리를 내보고, 소리굽쇠를 관찰하여 소리가 나는 물체는 떨림이 있음을 설명할 수 있다.","여러 가지 물체를 이용하여 소리를 내보고, 소리가 날 때 물체가 움직이는 모습을 관찰할 수 있다."
과학,3-4학년군,[4과07-02],▪큰 소리와 작은 소리를 구분하고 세기가 다른 소리를,"물체의 길이에 따른 소리의 높낮이를 비교하고, 큰 소리와 작은 소리, 높은 소리와 낮은 소리를 내는 방법을 알고 소리를 낼 수 있다.",소리의 높낮이를 비교하고 큰 소리와 작은 소리를 내는 방법을 설명할 수 있다.,"다양한 소리를 듣고, 큰 소리와 작은 소리, 높은 소리와 낮은 소리로 구분할 수 있다."
과학,3-4학년군,[4과07-03],여러 가지 물질을 통하여 소리가 전달되는 것을 관찰하기,"소리가 여러 가지 물질을 통하여 전달되는 것을 이해 하고, 일상생활에서 소음을 줄이는 방법을 조사하여 실천할 수 있다.","여러 가지 물질을 통하여 소리가 전달되는 것을 관찰 하고, 일상생활에서 소음을 줄이는 방법을 조사할 수 있다.","소리가 전달되고 있음을 알고, 일상생활에서 소음과 관련된 예를 들 수 있다."
과학,3-4학년군,[4과08-01],감염병의 사례를 조사하기,"생활 속 감염병 사례를 조사하고, 다양한 질병과 그 위험성에 대해 타당한 근거를 들어 토의할 수 있다.","생활 속 감염병 사례를 조사하고, 다양한 질병과 그 위험성에 대해 토의할 수 있다.",생활 속 감염병 사례를 조사하여 정리할 수 있다.
과학,3-4학년군,[4과08-02],감염병으로부터 안전한 사회에 관심갖기,"감염병으로부터 안전한 사회에 관심을 가지고,","감염병에 대해 인식하고, 여러 감염 과정을 통해 감염병에 걸릴 수 있음을 이해하며, 감염을 예방하는 생활 습관에 대해 말할 수 있다.","감염병에 대해 인식하고, 여러 감염 과정을 통해 감염병에 걸릴 수 있음을 설명할 수 있다."
과학,3-4학년군,[4과08-03],생활 속에서 감염병 예방 수칙의 중요성 인식하기,"건강한 생활을 위해 필요한 감염병 예방 수칙을 토의 하여 공유하고, 생활 속에서 감염병 예방 수칙의 중요성을 인식하며 이를 실천할 수 있다.",건강한 생활을 위해 감염병 예방 수칙을 알고 공유할 수 있으며 생활 속에서 감염병 예방 수칙의 중요성을 인식하고 있다.,건강한 생활을 위해 감염병 예방 수칙을 알고 공유할 수 있다.
국어,3-4학년군,[4국01-06],책의 주제를 정하여 친구들과 독서 토의 참여하기,"책 주제에 대한 자신의 생각을 비교하며 정리하고, 서로의 생각을 적극적으로 교환하며 다른 사람을 존중하는 태도로 토의에 참여할 수 있다.","책 주제에 대한 자신의 생각을 비교하며 정리하고, 서로의 생각을 교환하며 다른 사람을 존중하는 태도로 토의에 참여할 수 있다.","책 주제에 대한 자신의 생각을 비교하며 정리하고, 서로의 생각을 교환하는 토의 활동에 참여할 수 있다."
국어,3-4학년군,[4국02-04],책 이야기의 중심 내용을 찾고 정리하기,책의 중심 내용을 찾고 자신의 생각을 정리 한 후 책 주제에 대해 친구와 자신의 의견을 적극적으로 비교 할 수 있다.,책의 중심 내용을 찾고 자신의 생각을 정리 한 후 책 주제에 대해 친구와 자신의 의견을 비교할 수 있다.,책의 중심 내용을 찾고 자신의 생각을 정리 한 후 책 주제에 대해 친구와 자신의 의견을 일부 비교할 수 있다.
국어,3-4학년군,[4국05-02],자신의 경험을 떠올 리며 시와 이야기 읽기,자신의 경험을 바탕으로 작품 속 세계와 현실 세계의 공통점이나 차이점을 구체적으로 비교하고 작품에 대한 의견을 나누며 적극적으로 감상할 수,자신의 경험을 바탕으로 작품 속 세계와 현실 세계의 공통점이나 차이점을 비교하며 작품을 감상할 수 있다.,자신의 경험을 바탕으로 작품 속 세계와 현실 세계의 공통점이나 차이점을 일부 비교하며 작품을 감상할 수 있다.
국어,3-4학년군,[4국05-05],시나 이야기를 읽고 인상 깊은 장면 찾기,시나 이야기를 읽고 인상 깊은 장면을 찾아 그와 관련된 자신의 경험과 떠오르는 생각이나 느낌이 잘 드러나도록 표현할 수 있다.,시나 이야기를 읽고 인상 깊은 장면을 찾아 그와 관련된 자신의 경험과 떠오르는 생각이나 느낌을 포함하여 표현할 수 있다.,시나 이야기를 읽고 떠오르는 생각이나 느낌을 간단하게 표현할 수 있다.
국어,3-4학년군,[4국02-04],의견이 제시된 글에서 글쓴이의 의견 파악 하기,"의견이 제시된 글에서 서로 다른 글쓴이의 의견을 파악 하고,","의견이 제시된 글에서 서로 다른 글쓴이의 의견을 파악 하고, 그 의견에 대한 타당성 평가를 바탕으로 글쓴이와 자신의 의견을 비교할 수 있다.","의견이 제시된 글에서 서로 다른 글쓴이의 의견을 부분적으로 파악하고, 글쓴이와 자신의 의견을 비교 할 수 있다."
국어,3-4학년군,[4국01-06],작품 속 세계와 현실 세계를 비교해 작품 소개하기,"작품 속 세계와 현실 세계를 비교한 작품 소개 결과물을 자신의 생각을 구체적으로 담아 표현하고, 친구와 함","작품 속 세계와 현실 세계를 비교한 작품 소개 결과물을 자신의 생각을 담아 표현하고, 친구와 함께 서로의 생각을 나눌 수 있다.","작품 속 세계와 현실 세계를 비교한 작품 소개 결과물을 자신의 생각을 일부 담아 표현하고, 친구와 함께 서로의 생각을 나눌 수 있다."
국어,3-4학년군,[4국04-05],한글의 우수성이 담긴 한글 사랑 시 쓰고 전시하기,"한글의 우수성과 아름다움을 창의적으로 표현한 시를 완성도 높게 창작하고 전시하며, 국어의 가치와 소중함을 깊이 인식하고 표현할 수 있다.","한글의 우수성을 담은 시를 창작하고 전시하며, 국어의 소중함을 생각하여 표현할 수 있다.","한글의 특징이나 우수성이 드러나는 시를 쓰고 전시 하며, 국어에 대한 긍정적인 관심을 가질 수 있다."
국어,3-4학년군,[4국02-02],글의 중심 내용 간추 리기,"문단별로 중요 단어와 중심 문장을 정확하게 찾아내고, 문단별 중심 내용을 글의 구조에 맞게 구체적으로 정리 할 수 있다.","문단별로 중요 단어와 중심 문장을 찾아내고, 문단별 중심 내용을 글의 구조에 맞게 구체적으로 정리할 수 있다.","문단별로 중심 문장을 파악하고, 문단별 중심 내용을 대략적으로 정리할 수 있다."
국어,3-4학년군,[4국03-02],보고하는 글을 쓰는 방법 파악하기,"보고하는 글을 쓰는 방법을 정확하게 이해하고, 글쓰기 절차에 따라 우리말 사용에 대한 보고하는 글을 구체적으로 쓸 수 있다.","보고하는 글을 쓰는 방법을 정확하게 이해하고, 글쓰기 절차에 따라 우리말 사용에 대한 보고하는 글을 쓸 수 있다.","보고하는 글을 쓰는 방법을 대략적으로 이해하고, 글쓰기 절차에 따라 우리말 사용에 대한 보고하는 글을 간단히 쓸 수 있다."
국어,3-4학년군,[4국06-01],우리말 사용 실태를 조사하는 방법 정하기,우리말 사용 실태에 대한 다양한 조사 방법을 활용하여 효과적으로 탐색하고 목적에 적합한 자료를 선택하여 글을 쓸 내용을 정리할 수 있다.,"우리말 사용 실태에 대한 다양한 조사 방법을 활용하여 목적에 적합한 자료를 수집, 활용할 수 있다.",우리말 사용 실태에 대한 자료를 다양한 조사 방법을 활용하여 탐색하고 자료를 수집할 수 있다.
국어,3-4학년군,[4국01-06],토의하는 방법과 절차를 이해하고 활용하기,"토의하는 방법을 이해한 후,","토의하는 방법을 이해한 후, 일상생활 문제에 대해 의견을 나누는 과정에서 다른 사람을 존중하는 태도로 토의 활동에 적극적으로 참여할 수 있다.",일상생활 문제에 대한 의견을 나누는 과정에서 다른 사람을 존중하는 태도로 토의 활동에 참여할 수 있다.
국어,3-4학년군,[4국03-03],제안하는 글의 형식과 글을 쓰는 방법 이해 하기,"제안하는 글의 형식과 쓰는 방법을 바르게 이해하고, 일상생활의 문제를 해결하기 위한 실천 가능하며 타당한 이유가 담긴 제안 글을 쓸 수 있다.","제안하는 글의 형식과 글 쓰는 방법을 이해하고, 일상 생활의 문제를 해결할 수 있는 실천 가능한 내용이 포함 된 제안하는 글을 쓸 수 있다.","제안하는 글의 형식과 글 쓰는 방법을 일부 이해하고, 일상생활의 문제를 해결하기 위해 제안하는 내용이 포함된 글을 쓸 수 있다."
국어,3-4학년군,[4국03-01],중심 문장과 뒷받침 문장을 갖추어 문단 쓰기,설득력과 실현 가능성이 있는 제안하는 글의 형식과 문장의 짜임새에 맞는 문장을 확인하여 자신이 쓴 제안 하는 글을 효과적으로 고쳐 쓸 수 있다.,"설득력과 실현 가능성이 있는 제안하는 글의 형식을 파악하여, 제안하는 글을 적절하게 고쳐 쓸 수 있다.","자신이 쓴 제안하는 글을 확인한 후, 제안하는 글의 형식에 맞게 고쳐 쓸 수 있다."
국어,3-4학년군,[4국04-03],문장의 짜임 확인하기,"제시된 글에서 자연스럽게 이어지지 않은 문장을 확인한 후 문법 규칙에 맞게 수정하며,","제시된 글에서 자연스럽게 이어지지 않은 문장을 확인한 후 자연스럽게 이어지도록 수정하며,",제시된 글에서 자연스럽게 이어지지 않은 문장을 확인한 후 자연스럽게 이어지도록 고쳐 쓸 수 있다.
국어,3-4학년군,[4국06-02],발표할 자료의 종류에 따른 특징 이해하기,다양한 자료의 특징의 이해를 바탕으로 자신의 발표 주제와 관련된 적절한 자료를 찾는 과정을 통해 발표 자료 정리 보고서를 완성하고 친구들과,다양한 자료의 특징의 이해를 바탕으로 자신의 발표 주제와 관련된 자료를 찾는 과정을 통해 발표 자료 정리 보고서를 완성하고 친구들과 보완할 점을,자신의 발표 주제와 관련된 자료를 일부 찾아서 발표 자료 정리 보고서를 간단히 만들 수 있다.
국어,3-4학년군,[4국01-05],정리한 자료를 자신 있게 발표하기,"발표할 주제와 내용에 맞게 자료의 특성을 살려 내용을 효과적으로 전달하고, 듣는 이를 고려하여 자신감 있게 발표할 수 있다.","발표할 주제와 내용에 맞게 자료의 특성을 살려 내용을 전달하고, 듣는 이를 고려하여 자신감 있게 발표 할 수 있다.","발표할 주제와 내용에 맞게 자료의 특성을 살려 내용을 전달하고, 듣는 이를 고려하여 발표할 수 있다."
국어,3-4학년군,[4국05-03],시와 이야기를 읽고 생각이나 느낌 나누기,시와 이야기를 읽고 작품에 대한 생각과 느낌을 구체적 으로 포함하여 작품을 자세하게 소개할 수 있다.,시와 이야기를 읽고 작품에 대한 생각과 느낌을 포함하여 작품을 소개할 수 있다.,시와 이야기를 읽고 작품에 대한 생각과 느낌을 발표 할 수 있다.
국어,3-4학년군,[4국05-05],친구의 발표를 보고 재미나 감동을 느낀 부분 찾기,친구의 발표를 보고 재미나 감동을 느낀 부분을 찾고 그 이유를 구체적으로 들어 친구들과 적극적으로 이야기를 나눌 수 있다.,친구의 발표를 보고 재미나 감동을 느낀 부분을 찾아 친구들과 이야기를 나눌 수 있다.,발표를 보고 재미나 감동을 느낀 부분에 대해 친구들과 간략히 말할 수 있다.
국어,3-4학년군,[4국02-03],읽기 과정을 되 돌아보는 질문 만들기,"설명하는 글과 의견을 나타내는 글의 읽기 과정 질문을 직접 만들고 확인하여, 글을 구체적이고 능동적으로 이해할 수 있다.",설명하는 글과 의견을 나타내는 글의 읽기 과정 질문을 통해 글을 구체적으로 이해할 수 있다.,설명하는 글과 의견을 나타내는 글의 읽기 과정 질문을 통해 글을 일부 이해할 수 있다.
국어,3-4학년군,[4국01-04],온라인 예절을 지키며 온라인 대화 역할극 발표하기,"온라인 대화의 상황과 특성을 정확히 이해하고, 상대를 배려하는 표현을 적극적으로 활용하여 예의를 지키며 역할극에 참여할 수 있다.","온라인 대화의 상황과 특성을 이해하고, 상대를 배려하는 표현을 사용하여 예의를 지키며 역할극에 참여할 수 있다.","온라인 대화의 상황과 특성을 이해하고, 상대방을 배려 하는 표현을 일부 사용하여, 예의를 지키며 역할극에 참여할 수 있다."
국어,3-4학년군,[4국03-04],읽는 이를 고려하여 편지를 쓰는 방법을 이해하기,읽는 이를 고려하여 편지를 쓰는 방법을 정확하게 이해 하고 편지글의 형식에 맞게 전하고 싶은 마음이 잘 드러 나도록 편지글을 쓸 수 있다.,읽는 이를 고려하여 편지를 쓰는 방법을 이해하고 편지 글의 형식에 맞게 마음이 드러나도록 편지글을 쓸 수 있다.,읽는 이를 고려하여 편지를 쓰는 방법을 일부 이해하고 마음이 드러나는 표현을 일부 사용하여 편지글을 쓸 수 있다.
