교과,학년군,성취기준코드,평가요소,상,중,하
음악,3-4학년군,[4음01-04],연주,생활 속의 음악을 충분히 이해하여 음악을 경험하며 연주 활동에 관심을 가지고 적극적으로 참여한다.,생활 속의 음악을 이해하여 음악을 경험하며 연주 활동에 관심을 가지고 참여한다.,생활 속의 음악을 부분적으로 이해하여 음악을 경험하며 연주 활동에참여하려고 노력한다.(2) 감상성취기준성취기준별 성취수준
음악,3-4학년군,[4음02-01],감상,음악을 듣고 기초적인 음악 요소를 적극적으로 탐색하며 음악 요소의특성에 따라 적절하게 반응한다.,음악을 듣고 기초적인 음악 요소를 탐색하며 음악 요소의 특성에 따라반응한다.,음악을 듣고 기초적인 음악 요소에 대해 반응하려고 노력한다.
음악,3-4학년군,[4음02-02],감상,다양한 음악을 듣고 음악의 종류나 주제에 따른 음악적 특징을 발견하고 종합적으로 연관지어 구체적으로 이야기한다.,다양한 음악을 듣고 음악의 종류나 주제에 따른 음악적 특징을 발견하고 연관지어 이야기한다.,다양한 음악을 듣고 음악의 종류나 주제 등에 따른 음악적 특징을 발견하고 부분적으로 연관지어 이야기한다.
음악,3-4학년군,[4음02-03],감상,다양한 분위기나 쓰임을 가진 여러 종류의 음악을 듣고 주어진 조건에따라 음악의 분위기를 구체적으로 묘사하거나 쓰임에 대해 정확하게이야기한다.,다양한 분위기나 쓰임을 가진 여러 종류의 음악을 듣고 주어진 조건에따라 음악의 분위기를 묘사하거나 쓰임에 대해 이야기한다.,다양한 분위기나 쓰임을 가진 여러 종류의 음악을 듣고 주어진 조건에따라 음악의 분위기를 간단하게 묘사하거나 쓰임에 대해 이야기하려고노력한다.
음악,3-4학년군,[4음02-04],감상,생활 속에서 호기심을 가지고 다양한 음악을 듣고 음악을 친숙하게 느끼며 적극적으로 즐긴다.,생활 속에서 호기심을 가지고 음악을 듣고 음악을 친숙하게 느끼며 즐긴다.,생활 속에서 음악을 듣고 음악을 느끼며 즐기려고 노력한다.
음악,3-4학년군,[4음02-05],감상,우리 지역의 음악 문화유산을 적극적으로 찾아 듣고 음악 문화유산을충분히 이해하여 국악을 즐기는 태도를 갖는다.,우리 지역의 음악 문화유산을 찾아 듣고 음악 문화유산을 이해하여 국악을 즐기는 태도를 갖는다.,우리 지역의 음악 문화유산을 듣고 음악 문화유산을 부분적으로 이해하여 국악을 즐기는 태도를 가지려 노력한다.(3) 창작성취기준성취기준별 성취수준
음악,3-4학년군,[4음03-01],창작,경험에 관련된 느낌과 상상한 바를 어울리는 소리나 음악으로 즉흥적으로 표현하고 적극적으로 표현 활동하며 음악에 흥미를 갖는다.,경험에 관련된 느낌과 상상한 바를 소리나 음악으로 즉흥적으로 표현하며 음악에 대한 흥미를 갖는다.,"경험에 관련된 느낌과 상상한 바를 소리나 음악으로 즉흥적으로 표현하는 데 관심을 보이며, 음악에 대한 흥미를 가지려고 노력한다."
음악,3-4학년군,[4음03-02],창작,악곡의 특성을 충분히 이해하여 그 일부를 바꾸어 표현하고 음표·기호·숫자 등을 적절히 활용하여 간단한 악보로 나타낸다.,악곡의 특성을 이해하여 그 일부를 바꾸어 표현하고 음표·기호·숫자등을 활용하여 간단한 악보로 나타낸다.,악곡의 특성을 부분적으로 이해하여 그 일부를 바꾸어 표현하고 음표·기호·숫자 등을 일부 활용하여 간단한 악보로 나타내려고 노력한다.
음악,3-4학년군,[4음03-03],창작,기초적인 음악 요소를 적절하게 활용하여 음악 요소의 특징이 잘 나타나도록 소리나 음악으로 창의적으로 표현한다.,기초적인 음악 요소를 활용하여 음악 요소의 특징이 나타나도록 소리나 음악으로 표현한다.,기초적인 음악 요소를 활용하여 소리나 음악으로 표현하려고 노력한다.
미술,3-4학년군,[4미01-01],미적 체험,자연물과 인공물을 탐색하는 데 쓰이는 자신의 다양한 감각을 이해하고 적극적으로 활용할 수 있다.,자연물과 인공물을 탐색하는 데 쓰이는 자신의 다양한 감각을 발견하고 활용할 수 있다.,자연물과 인공물을 탐색하는 데 자신의 다양한 감각을 제한적으로 활용할수 있다.
미술,3-4학년군,[4미01-02],미적 체험,주변 대상을 체험하며 떠오른 느낌과 생각을 구체적이고 다양한 방법으로나타낼 수 있다.,주변 대상을 체험하며 떠오른 느낌과 생각을 다양한 방법으로 나타낼 수있다.,주변 대상을 체험하며 떠오른 느낌과 생각을 부분적으로 나타낼 수 있다.
미술,3-4학년군,[4미01-03],미적 체험,미적 탐색에 호기심을 갖고 적극적으로 참여하며 자신의 감각으로 대상의특징을 이해하고 설명할 수 있다.,미적 탐색에 호기심을 갖고 참여하며 자신의 감각으로 대상의 특징을 이해할 수 있다.,미적 탐색에 관심을 보이며 자신의 감각으로 대상의 특징을 부분적으로 이해할 수 있다.
미술,3-4학년군,[4미01-04],미적 체험,생활 속에서 활용되는 미술에 지속적인 관심을 가지고 여러 사례를 조사하여 미술의 특징과 역할을 다양하게 발견할 수 있다.,생활 속에서 활용되는 미술에 관심을 가지고 사례를 찾아 미술의 특징과역할을 발견할 수 있다.,생활 속에서 활용되는 미술에 관심을 보이며 미술의 특징과 역할을 발견하고자 노력한다.(2) 표현성취기준성취기준별 성취수준
미술,3-4학년군,[4미02-01],표현,관찰과 상상으로 다양한 아이디어를 떠올려 표현 주제를 구체화할 수 있다.,관찰과 상상으로 아이디어를 떠올려 표현 주제를 구체화할 수 있다.,관찰과 상상으로 아이디어를 떠올려 표현 주제를 나타낼 수 있다.
미술,3-4학년군,[4미02-02],표현,기본적인 표현 재료와 용구의 특성을 이해하고 설명하며 적절한 사용 방법을 익힐 수 있다.,기본적인 표현 재료와 용구의 특성을 이해하고 사용 방법을 익힐 수 있다.,기본적인 표현 재료와 용구의 특성을 부분적으로 이해하고 사용 방법을익히고자 노력한다.
미술,3-4학년군,[4미02-03],표현,"조형 요소의 다양한 특징을 자유롭게 탐색하여 이해하고 설명하며, 주제표현에 적합한 조형 요소를 찾아 알맞게 활용할 수 있다.",조형 요소의 특징을 자유롭게 탐색하여 이해하고 주제 표현에 알맞게 활용할 수 있다.,조형 요소의 일부 특징을 알고 주제 표현에 활용하려고 시도할 수 있다.
미술,3-4학년군,[4미02-04],표현,분명한 표현 의도를 가지고 주도적으로 작품을 제작하며 자기 작품을 소중히 여기는 태도를 실천한다.,표현 의도를 가지고 작품을 제작하며 자기 작품을 소중히 여기는 태도를가진다.,표현 의도를 작품 제작에 반영하고자 시도하며 자기 작품을 소중히 여기는태도를 가지려고 노력한다.
미술,3-4학년군,[4미02-05],표현,다양한 탐색을 통해 미술과 타 교과를 관련지어 주제를 표현하는 데 지속적으로 흥미를 가진다.,미술과 타 교과를 관련지어 주제를 표현하는 데 흥미를 가진다.,미술과 타 교과를 관련지어 주제를 표현하는 데 흥미를 가지려고 노력한다.(3) 감상성취기준성취기준별 성취수준
미술,3-4학년군,[4미03-01],감상,미술 작품을 자세히 보고 작품과 미술가에 관해 다양하게 질문할 수 있다.,미술 작품을 자세히 보고 작품과 미술가에 관해 질문할 수 있다.,미술 작품을 보고 작품과 미술가에 관해 일부 질문을 시도할 수 있다.
미술,3-4학년군,[4미03-02],감상,미술 작품의 다양한 특징과 작품에 관한 자신의 느낌과 생각을 구체적으로설명할 수 있다.,미술 작품의 특징과 작품에 관한 자신의 느낌과 생각을 설명할 수 있다.,미술 작품의 특징과 작품에 관한 자신의 느낌과 생각을 부분적으로 설명할수 있다
미술,3-4학년군,[4미03-03],감상,다양한 미술 문화에 관심을 가지고 미술 전시 및 행사에 주도적으로 참여할수 있다.,미술 문화에 관심을 가지고 미술 전시 및 행사에 참여할 수 있다.,미술 문화에 일부 관심을 가지고 미술 전시 및 행사에 제한적으로 참여할수 있다.
영어,3-4학년군,[4영01-01],이해,알파벳과 쉽고 간단한 단어의 소리를 듣고 정확하게 식별할 수 있다.,알파벳과 쉽고 간단한 단어의 소리를 듣고 대체로 식별할 수 있다.,알파벳과 매우 쉽고 간단한 단어의 소리를 반복하여 듣고 부분적으로 식별할수 있다.
영어,3-4학년군,[4영01-02],이해,알파벳 대소문자를 식별하여 정확하게 읽을 수 있다.,알파벳 대소문자를 식별하여 대체로 읽을 수 있다.,알파벳 대소문자를 식별하여 부분적으로 읽을 수 있다.
영어,3-4학년군,[4영01-03],이해,"쉽고 간단한 단어, 어구, 문장을 듣고 강세, 리듬, 억양을 정확하게 식별할수 있다.","쉽고 간단한 단어, 어구, 문장을 듣고 강세, 리듬, 억양을 대체로 식별할 수있다.","매우 쉽고 간단한 단어, 어구, 문장을 반복하여 듣고 강세, 리듬, 억양을 부분적으로 식별할 수 있다."
영어,3-4학년군,[4영01-04],이해,"소리와 철자의 관계를 이해하며 쉽고 간단한 단어, 어구, 문장을 정확하게소리 내어 읽을 수 있다.","소리와 철자의 관계를 이해하며 쉽고 간단한 단어, 어구, 문장을 대체로 소리내어 읽을 수 있다.","소리와 철자의 관계를 이해하며 매우 쉽고 간단한 단어, 어구, 문장을 부분적으로 소리 내어 읽을 수 있다."
영어,3-4학년군,[4영01-05],이해,"쉽고 간단한 단어, 어구, 문장을 듣거나 읽고 의미를 정확하게 이해할 수있다.","쉽고 간단한 단어, 어구, 문장을 듣거나 읽고 의미를 대체로 이해할 수 있다.","매우 쉽고 간단한 단어, 어구, 문장을 반복하여 듣거나 읽고 시각 자료 등의도움을 받아 의미를 부분적으로 이해할 수 있다."
영어,3-4학년군,[4영01-07],이해,적절한 전략을 다양하게 활용하여 담화나 문장을 듣거나 읽을 수 있다.,적절한 전략을 일부 활용하여 담화나 문장을 듣거나 읽을 수 있다.,예시를 참고하여 적절한 전략을 일부 활용하여 담화나 문장을 듣거나 읽을수 있다.
영어,3-4학년군,[4영01-08],이해,다양한 매체로 표현된 담화나 문장을 높은 흥미를 가지고 스스로 찾아 듣거나읽는다.,다양한 매체로 표현된 담화나 문장을 대체로 흥미를 가지고 듣거나 읽는다.,다양한 매체로 표현된 담화나 문장을 흥미를 가지려고 노력하며 듣거나 읽는다.
영어,3-4학년군,[4영01-09],이해,"시, 노래, 이야기를 스스로 찾아 들으면서 화자의 기쁨, 슬픔 등의 감정을느끼고 적극적으로 공감하는 태도를 보인다.","시, 노래, 이야기를 들으면서 화자의 기쁨, 슬픔 등의 감정을 느끼고 공감하는태도를 보인다.","시, 노래, 이야기를 들으면서 화자의 기쁨, 슬픔 등의 감정을 느끼고 공감하는태도를 가지려고 노력한다."
영어,3-4학년군,[4영02-01],표현,"쉽고 간단한 단어, 어구, 문장을 듣고 강세, 리듬, 억양에 맞게 정확하게 따라말할 수 있다.","쉽고 간단한 단어, 어구, 문장을 듣고 강세, 리듬, 억양에 맞게 대체로 따라말할 수 있다.","매우 쉽고 간단한 단어, 어구, 문장을 반복하여 듣고 강세, 리듬, 억양에 맞게부분적으로 따라 말할 수 있다."
영어,3-4학년군,[4영02-02],표현,알파벳 대소 문자를 구별하여 정확하게 쓸 수 있다.,알파벳 대소 문자를 구별하여 대체로 쓸 수 있다.,알파벳 대소 문자를 구별하여 부분적으로 쓸 수 있다.
영어,3-4학년군,[4영02-03],표현,소리와 철자의 관계를 바탕으로 쉽고 간단한 단어를 정확하게 쓸 수 있다.,소리와 철자의 관계를 바탕으로 쉽고 간단한 단어를 대체로 쓸 수 있다.,소리와 철자의 관계를 바탕으로 매우 쉽고 간단한 단어를 부분적으로 쓸 수있다.
영어,3-4학년군,[4영02-06],표현,행동을 지시하는 말을 적절한 단어와 언어 형식을 사용하여 쉽고 간단한 문장으로 말하거나 제시된 문장을 정확하게 보고 쓸 수 있다.,행동을 지시하는 말을 적절한 단어를 사용하여 쉽고 간단한 문장으로 대체로말하거나 제시된 문장을 대체로 보고 쓸 수 있다.,주어진 도움 자료를 사용하여 행동을 지시하는 말을 매우 쉽고 간단한 문장으로 부분적으로 말하거나 제시된 문장을 부분적으로 보고 쓸 수 있다.
영어,3-4학년군,[4영02-07],표현,자신의 감정을 적절한 단어와 언어 형식을 사용하여 쉽고 간단한 문장으로말하거나 제시된 문장을 정확하게 보고 쓸 수 있다.,자신의 감정을 적절한 단어를 사용하여 쉽고 간단한 문장으로 대체로 말하거나 제시된 문장을 대체로 보고 쓸 수 있다.,주어진 도움 자료를 사용하여 자신의 감정을 매우 쉽고 간단한 문장으로 부분적으로 말하거나 제시된 문장을 부분적으로 보고 쓸 수 있다.
영어,3-4학년군,[4영02-08],표현,자기 주변 주제에 관한 담화의 주요 정보를 적절한 단어와 언어 형식에 맞게묻거나 답할 수 있다.,자기 주변 주제에 관한 담화의 주요 정보를 적절한 단어를 사용하여 대체로묻거나 답할 수 있다.,자기 주변 주제에 관한 담화의 주요 정보를 주어진 단어를 참고하여 부분적으로 묻거나 답할 수 있다.
영어,3-4학년군,[4영02-09],표현,적절한 매체나 전략을 다양하게 활용하여 창의적으로 의미를 표현할 수 있다.,적절한 매체나 전략을 일부 활용하여 창의적으로 의미를 표현할 수 있다.,예시를 참고하여 적절한 매체나 전략을 일부 활용하여 창의적으로 의미를 표현할 수 있다.
국어,5-6학년군,[6국01-01],듣기⋅ 말하기,대화에서 들은 내용에 담긴 정보와 맥락을 적극적으로 활용하여 드러나지않거나 생략된 내용을 적절하게 추론하며 들을 수 있다.,대화에서 들은 내용에 담긴 정보와 맥락을 활용하여 드러나지 않거나 생략된내용을 추론하며 들을 수 있다.,대화에서 들은 내용에 담긴 정보와 맥락을 제한적으로 활용하여 드러나지않거나 생략된 내용을 부분적으로 추론하며 듣는다.
국어,5-6학년군,[6국01-02],듣기⋅ 말하기,"상대의 주장, 이유, 근거를 정확하게 파악하고, 이유나 근거가 주장을 타당하게 뒷받침하는지 적극적으로 평가하며 들을 수 있다.","상대의 주장, 이유, 근거를 파악하고, 이유나 근거가 주장을 타당하게 뒷받침하는지 평가하며 들을 수 있다.","상대의 주장, 이유, 근거를 제한적으로 파악하고, 이유나 근거를 부분적으로평가하며 듣는다."
국어,5-6학년군,[6국01-03],듣기⋅ 말하기,"듣기 목적에 맞게 주제와 관련하여 궁금한 내용에 대해 분명한 표현으로 질문하며, 적극적으로 듣고 말할 수 있다.","듣기 목적에 맞게 주제와 관련하여 궁금한 내용에 대해 질문하며, 적극적으로 듣고 말할 수 있다.",주제와 관련하여 궁금한 내용에 대해 제한적으로 질문하며 듣고 말한다.
국어,5-6학년군,[6국01-04],듣기⋅ 말하기,"면담의 절차를 이해하여 상황에 맞게 적절하게 적용하고, 상대와 매체를 고려하여 효과적으로 면담할 수 있다.","면담의 절차를 이해하여 단계적으로 수행하고, 상대와 매체를 고려하여 면담할 수 있다.",면담의 절차를 부분적으로 이해하고 상대와 매체를 일부 고려하여 면담한다.
국어,5-6학년군,[6국01-07],듣기⋅ 말하기,"토론의 절차와 규칙을 정확하게 지키며, 주장에 대한 타당한 이유와 근거를명확하게 제시하며 토론할 수 있다.","토론의 절차와 규칙을 지키며, 주장에 대한 타당한 이유와 근거를 제시하며토론할 수 있다.","토론의 절차와 규칙을 제한적으로 따르며, 주장에 대한 이유나 근거를 일부제시하며 토론에 참여한다.(2) 읽기성취기준성취기준별 성취수준"
국어,5-6학년군,[6국02-01],읽기,글의 구조를 고려하며 주제나 주장을 정확하게 파악하고 글의 내용을 자신의언어로 중심 내용이 잘 드러나게 요약할 수 있다.,글의 구조를 고려하며 주제나 주장을 파악하고 글의 내용을 자신의 언어로요약할 수 있다.,글의 구조를 고려하며 글의 내용을 부분적으로 파악하고 이를 요약한다.
국어,5-6학년군,[6국02-02],읽기,"글의 문맥을 고려하여 의미를 이해할 수 있으며 생략된 내용이나 이어질 내용, 함축된 표현을 정확하게 추론할 수 있다.",글의 문맥을 고려하여 생략된 내용이나 함축된 표현을 추론할 수 있다.,글의 문맥을 일부 고려하며 글에서 생략된 내용과 함축된 표현을 제한적으로추론한다.
국어,5-6학년군,[6국02-03],읽기,글이나 자료를 읽고 평가 근거를 토대로 내용의 타당성과 표현의 적절성을종합적으로 평가할 수 있다.,글이나 자료를 읽고 평가 근거를 토대로 내용의 타당성과 표현의 적절성을평가할 수 있다.,글이나 자료를 읽고 내용의 타당성이나 표현의 적절성을 부분적으로 평가한다.
국어,5-6학년군,[6국02-04],읽기,"문제 상황과 관련된 다양한 관점의 글을 읽고, 내용의 타당성과 유용성을평가하여 문제 해결 방안을 마련하는 데 이를 활용할 수 있다.",문제 상황과 관련된 다양한 관점의 글을 읽고 문제 해결 방안을 마련하는데 이를 활용할 수 있다.,문제 상황과 관련된 다양한 관점의 글을 읽고 문제 해결 방안을 마련하는데 이를 제한적으로 활용한다.
국어,5-6학년군,[6국02-05],읽기,"읽기의 중요성과 가치를 인식하고, 긍정적인 읽기 동기를 형성하며 읽기 활동에 적극적이고 주도적으로 참여하는 태도를 지닌다.",긍정적인 읽기 동기를 형성하며 읽기 활동에 적극적으로 참여하는 태도를지닌다.,긍정적인 읽기 동기 형성과 읽기 활동에 대한 참여가 제한적이다.(3) 쓰기성취기준성취기준별 성취수준
국어,5-6학년군,[6국03-02],쓰기,주장을 뒷받침하는 이유와 적절한 근거를 들고 인용의 출처를 정확하게 밝히며 자신의 주장을 설득력 있게 제시하는 주장하는 글을 쓸 수 있다.,주장과 관련한 적절한 근거를 들고 인용의 출처를 밝히며 자신의 주장을 명확하게 제시하는 주장하는 글을 쓸 수 있다.,주장과 관련한 근거를 들고 인용의 출처를 부분적으로 밝히며 주장하는 글을쓴다.
국어,5-6학년군,[6국03-03],쓰기,체험한 일과 이에 대한 감상을 풍부하게 나타내는 글을 쓸 수 있다.,체험한 일에 대한 감상을 나타내는 글을 쓸 수 있다.,일상의 체험에 대한 감상을 일부 나타내는 글을 쓴다.
국어,5-6학년군,[6국03-04],쓰기,독자와 매체와 같은 쓰기의 상황 맥락을 전체적으로 고려하여 적절한 내용을생성하고 효과적으로 표현하며 글을 쓸 수 있다.,독자와 매체와 같은 쓰기의 상황 맥락을 고려하여 내용을 생성하고 표현하며글을 쓸 수 있다.,독자 또는 매체를 고려하여 내용을 일부 생성하고 표현하며 글을 쓴다.
국어,5-6학년군,[6국03-06],쓰기,쓰기 맥락을 고려하여 쓰기에 적극적이고 주도적으로 참여하며 자신의 글을다양한 독자와 공유하는 태도를 지닌다.,쓰기 맥락을 고려하여 쓰기에 적극적으로 참여하며 자신의 글을 독자와 공유하는 태도를 지닌다.,쓰기에 참여하며 자신의 글을 독자와 공유하려는 태도를 지닌다.(4) 문법성취기준성취기준별 성취수준
국어,5-6학년군,[6국04-01],문법,음성 언어 및 문자 언어의 특성을 분석하고 다양한 매체 자료에서 표현 효과를 종합적으로 평가할 수 있다.,음성 언어 및 문자 언어의 특성을 이해하고 매체 자료에서 표현 효과를 분석할 수 있다.,음성 언어와 문자 언어의 특성을 확인하고 매체 자료에서 표현 효과를 제한적으로 이해한다.
국어,5-6학년군,[6국04-02],문법,표준어와 방언의 다양한 기능을 분석하고 언어 공동체와 국어생활과의 관계를 종합적으로 이해할 수 있다.,표준어와 방언의 기능을 이해하고 언어 공동체와 국어생활과의 관계를 이해할 수 있다.,표준어와 방언의 기능을 확인하고 언어 공동체와 국어생활과의 관계를 제한적으로 이해한다.
국어,5-6학년군,[6국04-03],문법,고유어와 관용 표현의 다양한 쓰임과 가치를 분석하고 적절한 표현을 상황에따라 효과적으로 활용할 수 있다.,고유어와 관용 표현의 쓰임과 가치를 이해하고 이를 상황에 따라 표현할 수있다.,고유어와 관용 표현의 쓰임과 가치를 확인하고 일부를 상황에 따라 제한적으로 표현한다.
국어,5-6학년군,[6국04-04],문법,문장 성분을 분석하고 국어생활에서 호응 관계가 올바른 다양한 문장을 구성할 수 있다.,문장 성분을 이해하고 문장 성분이 호응 관계를 이루는 문장을 구성할 수있다.,문장 성분을 확인하고 문장 성분이 호응 관계를 이루는 문장을 제한적으로구성한다.
국어,5-6학년군,[6국04-05],문법,글과 담화에 쓰인 다양한 시간 표현을 분석하고 적절한 표현을 상황에 따라효과적으로 활용할 수 있다.,글과 담화에 쓰인 시간 표현을 이해하고 이를 상황에 따라 표현할 수 있다.,글과 담화에 쓰인 시간 표현을 확인하고 일부를 상황에 따라 제한적으로 표현한다.
국어,5-6학년군,[6국04-06],문법,"국어생활에서 글과 담화에 쓰인 단어 및 문장, 띄어쓰기를 민감하게 점검하여 바르게 고치는 태도를 내면화한다.","글과 담화에 쓰인 단어 및 문장, 띄어쓰기를 점검하여 바르게 고치는 태도를지닌다.","글과 담화에 쓰인 단어 및 문장, 띄어쓰기를 제한적으로 점검하고 바르게고치는 것에 관심을 가진다.(5) 문학성취기준성취기준별 성취수준"
국어,5-6학년군,[6국05-01],문학,작가의 의도를 적절하게 생각하며 작품을 깊이 있게 읽을 수 있다.,작가의 의도를 생각하며 작품을 읽을 수 있다.,작가의 의도를 부분적으로 생각하며 작품을 읽는다.
국어,5-6학년군,[6국05-02],문학,비유적 표현의 특성과 효과에 유의하여 작품을 즐겨 감상할 수 있다.,비유적 표현의 효과에 유의하여 작품을 감상할 수 있다.,비유에 대한 부분적인 이해를 바탕으로 비유적 표현을 찾으며 작품을 읽는다.
국어,5-6학년군,[6국05-03],문학,"인물, 사건, 배경에 대한 이해를 바탕으로 소설이나 극을 읽고 인물, 사건,배경을 적절하게 정리할 수 있다.","인물, 사건, 배경에 대한 이해를 바탕으로 소설이나 극을 읽고 인물, 사건,배경을 찾을 수 있다.","소설이나 극을 읽고 인물, 사건, 배경이 있음을 안다."
국어,5-6학년군,[6국05-04],문학,작품에서 인상적인 부분을 찾아 그 이유를 작품과 연결 지어 구체적으로 설명하고 다른 사람과 의견을 즐겨 나눌 수 있다.,작품에서 인상적인 부분을 찾아 그 이유를 말하면서 다른 사람과 의견을 나눌 수 있다.,작품에서 인상적인 부분을 찾아 자신의 의견을 말한다.
국어,5-6학년군,[6국05-05],문학,"일상생활에서의 경험을 시, 소설, 극, 수필 등의 적절한 갈래로 창의적으로표현할 수 있다.","일상생활에서의 경험을 시, 소설, 극, 수필 등의 갈래로 표현할 수 있다.","일상생활에서의 경험을 시, 소설, 극, 수필 등의 갈래로 간단하게 표현한다."
국어,5-6학년군,[6국05-06],문학,작품을 읽고 자신의 삶을 작품과 적절하게 연관 지어 탐색하고 적극적으로성찰하는 태도를 지닌다.,작품을 읽고 자신의 삶을 작품과 연관 지어 탐색하고 성찰하는 태도를 지닌다.,작품을 읽고 연관된 자신의 경험을 떠올리는 태도를 지닌다.(6) 매체성취기준성취기준별 성취수준
